{
  "version": "1.0.0",
  "type": "user",
  "label_count": 57,
  "labels": [
    {
      "name": "how_collaboration",
      "display_name": "How Collaboration",
      "description": "How this person collaborates with others, teamwork style",
      "category": "HOW",
      "sensitivity": "tier_work",
      "cardinality": "plural",
      "durability": "transient",
      "examples": [
        "Prefers pair programming for complex features",
        "Likes async code reviews over synchronous walkthroughs",
        "Thrives in small cross-functional teams (3-5 people)",
        "Prefers to work independently and sync at standups"
      ],
      "classification_guidance": "Captures the person's teamwork and collaboration patterns, including whether they prefer pair programming, async collaboration, or in-person brainstorming. Distinct from communication style which focuses on channels and tone rather than group dynamics.",
      "anti_examples": [
        "Prefers Slack over email \u2192 use how_communication",
        "Works remotely \u2192 use where_work_environment"
      ]
    },
    {
      "name": "how_communication",
      "display_name": "How Communication",
      "description": "How they communicate \u2014 channels, frequency, style preferences",
      "category": "HOW",
      "sensitivity": "tier_public",
      "cardinality": "plural",
      "durability": "transient",
      "examples": [
        "Prefers Slack for quick questions, email for formal requests",
        "Likes async communication over real-time meetings",
        "Prefers video calls with camera on for team meetings",
        "Sends detailed written updates instead of holding meetings"
      ],
      "classification_guidance": "Covers preferred communication channels (Slack, email, video calls), frequency of check-ins, and interaction patterns. Focuses on the mechanics of communication rather than personality-driven tone (see who_communication_style).",
      "anti_examples": [
        "Is direct and blunt \u2192 use who_communication_style",
        "Uses Figma daily \u2192 use where_digital_environments"
      ]
    },
    {
      "name": "how_content_creation",
      "display_name": "How Content Creation",
      "description": "How they create content \u2014 writing, video, design approaches",
      "category": "HOW",
      "sensitivity": "tier_personal",
      "cardinality": "plural",
      "durability": "transient",
      "examples": [
        "Writes blog posts in Markdown, publishes on personal site",
        "Creates technical videos with screen recordings and voiceover",
        "Designs in Figma, follows a mobile-first approach",
        "Outlines extensively before writing \u2014 never writes ad-hoc"
      ],
      "classification_guidance": "Describes their approach to creating content such as blog posts, videos, documentation, or design artifacts. Includes tools, processes, and creative methodology.",
      "anti_examples": [
        "Published a paper on ML \u2192 use what_publications_ip",
        "Knows Adobe Premiere \u2192 use what_skills"
      ]
    },
    {
      "name": "how_decision_making",
      "display_name": "How Decision Making",
      "description": "How they make decisions \u2014 analytical, intuitive, collaborative",
      "category": "HOW",
      "sensitivity": "tier_personal",
      "cardinality": "plural",
      "durability": "transient",
      "examples": [
        "Highly data-driven, needs metrics before deciding",
        "Trusts gut instinct for people decisions, data for tech decisions",
        "Prefers to get input from the team before committing",
        "Conservative with risk \u2014 prefers proven approaches"
      ],
      "classification_guidance": "Captures decision-making methodology: data-driven vs intuitive, consensus-seeking vs autonomous, risk-tolerant vs conservative. Describes the process, not the outcomes.",
      "anti_examples": [
        "Prioritizes family over work \u2192 use why_priorities",
        "Avoids confrontation \u2192 use who_personality"
      ]
    },
    {
      "name": "how_learning",
      "display_name": "How Learning",
      "description": "How they learn \u2014 visual, hands-on, reading, courses, mentorship",
      "category": "HOW",
      "sensitivity": "tier_personal",
      "cardinality": "plural",
      "durability": "transient",
      "examples": [
        "Learns best by building projects from scratch",
        "Prefers video tutorials over written docs",
        "Reads research papers and technical books",
        "Benefits from pair programming with more experienced devs"
      ],
      "classification_guidance": "Describes learning modalities and preferences: video tutorials, reading documentation, hands-on experimentation, formal courses, or mentorship. Focuses on the process of acquiring knowledge, not what they know.",
      "anti_examples": [
        "Has a CS degree \u2192 use what_education",
        "Knows Python \u2192 use what_skills"
      ]
    },
    {
      "name": "how_problem_solving",
      "display_name": "How Problem Solving",
      "description": "How they approach and solve problems",
      "category": "HOW",
      "sensitivity": "tier_personal",
      "cardinality": "plural",
      "durability": "transient",
      "examples": [
        "Breaks problems down into small, testable hypotheses",
        "Likes to whiteboard and diagram before coding",
        "Uses rubber-duck debugging regularly",
        "Starts with the simplest possible solution, then iterates"
      ],
      "classification_guidance": "Captures problem-solving approach: systematic debugging, rubber-duck thinking, divide-and-conquer, or creative lateral thinking. About methodology, not the problems themselves.",
      "anti_examples": [
        "Good at debugging \u2192 use what_skills",
        "Makes decisions by committee \u2192 use how_decision_making"
      ]
    },
    {
      "name": "how_tech_adoption",
      "display_name": "How Tech Adoption",
      "description": "How they adopt new technology \u2014 early adopter vs cautious",
      "category": "HOW",
      "sensitivity": "tier_personal",
      "cardinality": "plural",
      "durability": "transient",
      "examples": [
        "Early adopter \u2014 tries new frameworks on day one",
        "Waits for a tool to mature before adopting it",
        "Evaluates new tech through small proof-of-concept projects",
        "Conservative: sticks with battle-tested tools unless there's a clear benefit"
      ],
      "classification_guidance": "Describes their stance on adopting new technologies, frameworks, and tools. Ranges from bleeding-edge early adopter to conservative wait-and-see. Distinct from what tech they actually use.",
      "anti_examples": [
        "Uses React and TypeScript \u2192 use what_tech_stack",
        "Knows Kubernetes \u2192 use what_skills"
      ]
    },
    {
      "name": "how_work_life_balance",
      "display_name": "How Work Life Balance",
      "description": "How they balance work and personal life, boundaries",
      "category": "HOW",
      "sensitivity": "tier_personal",
      "cardinality": "plural",
      "durability": "transient",
      "examples": [
        "Strict no-work policy after 6pm",
        "Checks email on weekends but doesn't code",
        "Takes regular mental health days",
        "Blends work and life \u2014 enjoys working on side projects evenings"
      ],
      "classification_guidance": "Captures boundaries between work and personal life, including overtime policies, weekend availability, and personal time protection strategies.",
      "anti_examples": [
        "Works 9-5 \u2192 use when_work_schedule",
        "Works from home \u2192 use where_work_environment"
      ]
    },
    {
      "name": "how_workflow",
      "display_name": "How Workflow",
      "description": "How they organize work \u2014 task management, processes, habits",
      "category": "HOW",
      "sensitivity": "tier_personal",
      "cardinality": "plural",
      "durability": "transient",
      "examples": [
        "Uses Todoist for personal tasks and Jira for work",
        "Follows a strict Pomodoro technique (25/5 intervals)",
        "Practices Agile/Scrum with 2-week sprints",
        "Keeps a daily standup journal in Notion"
      ],
      "classification_guidance": "Describes work organization: task management systems (Jira, Todoist), development processes (Agile, Kanban), personal productivity habits, and work rituals. About structure and process.",
      "anti_examples": [
        "Most productive in the morning \u2192 use when_productivity_patterns",
        "Uses VS Code \u2192 use what_tech_stack"
      ]
    },
    {
      "name": "what_active_projects",
      "display_name": "What Active Projects",
      "description": "Current projects they're working on",
      "category": "WHAT",
      "sensitivity": "tier_work",
      "cardinality": "plural",
      "durability": "ephemeral",
      "examples": [
        "Building a personal finance tracker app",
        "Leading the migration to microservices at work",
        "Contributing to the FastAPI open source project",
        "Working on a machine learning side project for music recommendation"
      ],
      "classification_guidance": "Lists current projects the person is actively working on, including side projects, open source contributions, and work assignments. These are temporal and change frequently.",
      "anti_examples": [
        "Previously worked on X \u2192 use who_work_history",
        "Wants to build a startup \u2192 use why_goals"
      ]
    },
    {
      "name": "what_certifications",
      "display_name": "What Certifications",
      "description": "Professional certifications, credentials, licenses",
      "category": "WHAT",
      "sensitivity": "tier_work",
      "cardinality": "plural",
      "durability": "permanent",
      "examples": [
        "AWS Solutions Architect Professional",